appid,review,voted_up,timestamp_created,playtime_forever,num_reviews
1903340,h1 absolute cinema h1 i was hesitant of getting the game due to how hyped it was but it did not disappoint from it coming out of nowhere to being one of the top reviewed games of all time i would be shocked if it didn't get goty h2 the good h2 list the gameplay is fantastic the fusion of traditional turnbased combat with a skillbased parry system works swimmingly it's incredibly engaging and i hope more games adopt this style i struggled with parrying at first until learning there was an audio cue that i couldn't hear when streaming to my tv once i switched to by pc and its speakers i could clearly hear it and had a much better experience the soundtrack is phenomenal easily one of the best i've ever heard the story was wild and unpredictable i never knew what was about to happen and the actors' performances were top tier one of the most original stories we've had in a long time list h2 the notsogood h2 with how praised the game is it was hard for me to find legitimate criticisms before i bought it so here's what i had issues with list the movement is kinda janky overall it's fine but there are platforming sections and parkour challenges think chained together those can be annoying when your character decides to roll off an edge or not read a jump input the game took from the black myth wukong school of design when it came to invisible walls some areas have visually open spaces that are inaccessible for no reason the foglighting was a little dramatic and i would have trouble seeing sometimes most of the game looks fantastic and like a painting however there were certain areas where it got to be a bit much my screen would get washed out from the fog or it would be near pitch black in some of the dark areas your characters would pull out a lantern to light it up and in others they wouldn't for some reason list h2 the bad h2 it's ue5 so performance is not the best while static scenes look great lots of motion or particles can create shimmering due to the antialiasing i also had to run the game on medium settings with a 60 fps cap in order to not crash i never found the root of the crashing as my gpu temps and power draws all looked okay for context my specs are cpu i711700k gpu rtx 4070 ram 32gb the game ran perfectly fine at high settings but it would give a fatal error message and close after 1015 minutes h2 overall h2 the game is great especially at the price point as long as you can get it to not crash you'll have a good time,True,1760472735,1837,4
1903340,this game should be game of the year i loved everything about it the story combat visuals character design and sound design,True,1760472437,6157,1
1903340,easily game of the year great soundtrack very good story engaging and refreshing gameplay it's up there with baldurs gate 3 and patched cyberpunk as contendender for the best game of the decade in my opinion,True,1760470287,1024,47
1903340,cool game,True,1760469546,3161,40
1903340,for those who come after,True,1760468661,1612,60
1903340,absolute cenima,True,1760468549,4842,23
1903340,h3 what if the farmer and turkeys from 3 body problem have feelings for each other h3 this game has absolutely ruined my appetite for fantasy games because it dwarfed others' music story arch and character design coincidentally enough i learned from an interview that the director's favorite game growing up is ff series well congratulations to him and the dev team because they truly made a game dare i say a game comparably to some of the best ff entries but exceeding them in varies aspects the rest of the review has little to none spoilers spoilerfrom my past reading experience with pocket universe settings like this game the god is always cold and cruel while this game makes me feel like we are probably not that lonely and feeble in the vast and sometimes inconceivable universe with love care and inspiration for art it's not that bad of an existence as a speciespoiler we have the chance to experience master piece story like this me happy turkey noise,True,1760465323,4401,2
1903340,i liked it a lot it got me both laughing and crying even got to a point where i was so damn hooked that i forgot i had to stop playing to eat or sleep,True,1760464580,5713,5
1903340,good game,True,1760464185,5243,5
1903340,expedition 33 is one of those games where you must go in completely blind or else the magic of the narrative is lost to some degree if you are reading this review and you have not already played the game you're already seeing too much don't look at other reviews don't look at the teaser videos or images on the home page and do not watch a playthrough if you plan on trying out this game if you must know the combat is turn based and the story is the single greatest stories i've ever seen in a video game i do not enjoy turn based combat i no longer cared what the combat medium was the story was that good and the combat is still better than most turnbased games,True,1760464089,4158,29
1903340,pros amazing world story and characters cons french people,True,1760463565,2433,7
1903340,i bought this game despite sort of knowing i wouldn't like it mainly because i'd watched a few reviews that made me think it wouldn't be up my alley however it's difficult to ignore games that are rated overwhelmingly positive on steam so i decided to give it a go a few seconds after starting i was already annoyed by the developer's message suggesting i plug in my controller first of all you sold this to a pc gamer on steam and so i assume you realize that there are pc gamers who will not use or have controllers the game plays fine on a keyboard and mouse but don't tell me how to enjoy your game the game itself starts out very slow and artistic with long scenes of meloncholic views at the horizon which sets the stage for the plot the plot is revealed very slowly over the coming hours as you explore the plot itself seems interesting enough and there's a certain curiosity to continue playing it but after 12 hours i feel that there is unlikely a redemption arc coming that would change my review to positive for me what sells a game to a gamer is whether the gameplay itself is worthwhile and while the scenery is beautiful the gameplay just falls short of being enjoyable the complete lack of a map forces this sort of old school exploration that requires you to check every nook and cranny to find goodies more often finding enemies that force you into a fight which brings us to the combat the game reminds me a lot of nierautomata where you're wandering around trying to explore areas and getting into combat now and then but the above mentioned game is at least live action so you can run away or finish the fights quickly expedition 33 requires you to go into turnbased combat the mechanics of which are reminiscent of dragon quest and final fantasy from the 1980s you basically select attack or skill or use item or run away to use such ancient game mechanics felt like a really poor choice as well in what is a weird sort of merge between the quicktime event qte games like sekiro and dark souls genre and the aforementioned dragon quest and final fantasy mechanics of you go and then i go and then you go and then i go this game allows you to avoid all damage if your reflexes are fast enough so you can't simply say this game is a tribute to old school gaming since it rewards qte gamers more than those of us whose reflexes are long gone i began losing interest in the game when i started meeting some of the npcs who have similarly weird and meaningless dialogue like nierautomata but also seem to be some kind of take on despicable me's minions they have silly voices and sillier quests many of which are simply to get various cosmetic tweaks overall i fail to see why this game is anything more than a 610 but it may be a generational or genre divide that i don't understand i can see the merits of the game in some respects but the tedium of the combat the silliness of the gestrals the poor map and hud options and overstylized melodramatic cutscenes just didn't grab me,False,1760463143,755,191
1903340,a story that wrecks your emotions,True,1760462658,1729,12
1903340,one of the best stories i've ever had the joy to experience absolute masterpiece 3310 game,True,1760462465,4496,3
1903340,phenomenal story art direction music animations game mechanics is fantastic and enjoyable but it can get repetitive and time consuming unfortunately fantastic soundtrack can only sustain you so long i eventually opted in on lowest difficulty and tried my best to avoid all the mobs and minibosses i just needed to know how the story would conclude now i can see myself enjoying the 2nd play through if i find free 40 hours but thats not gonna happen anytime soon not an avid gamer so this doesnt say much but e33 is my favorite game of the decade,True,1760462056,1165,4
1903340,dfinitivement le jeux de l'anne bien que l'on sent de par le dvellopement et l'impact de certains personnage de l'expdition que le jeux a t dveloper par 33 individus n'hsitez pas faire votre premire run en en mode normal vous aurez pleinement le temps de vous donner du challenge en new game avec un nouveau regard sur l'histoire,True,1760461757,9603,2
1903340,i cried multiple times,True,1760460914,5763,3
1903340,peak,True,1760460460,4696,3
1903340,nice stting very detailed and unique world battles are not my style but in story mode it's ok to play,True,1760459619,1056,5
1903340,forgot to eat for 12 hours because i was too busy playing,True,1760458820,3321,21
1903340,really engrossing story exploring grief and its effects that falters a little in act 3 with some pacing issues gameplay and animations are fun and flashy very enjoyable for somehow who likes turnbased games ngl i did not enjoy the clunky gestral minigames but that's just a minor part of the game overall a fantastic game that feels very deliberate in its storytelling with gorgeous maps and memorable music to luxuriate in and explore,True,1760456520,4590,3
1903340,this is a ireallyi fun ireallyi flawed game the combat is exceptionally satisfying but i dreaded every time i had to open the menu and navigate that ui the world is gorgeous but exploration can become a chore with no map or other indicator of where the heck you're going even a compass in the overworld please the characters and lore are incredibly rich but there are certain elements of the story that completely undermine the player's experience and i don't know if the writers truly understood the implications of those narrative choices the soundtrack is one of the best game soundtracks of recent years and honestly of all time the ending will stay with me for a while i think it's a great game that has issues so in other words a great game i can't wait to see what sandfall does next i hope whatever it is has heaps and heaps of qol and ux improvements though,True,1760455780,4001,22
1903340,i wish i could tell people how tight this game really is absolute cinema,True,1760454523,2522,8
1903340,a masterpiece worth of its place in my personal all time podium for story driven games must buy,True,1760448562,4592,2
1903340,i envy them those who know not that they are not it has been a long while for such a prominent creative concept to go as far as this title did the design the performance the experience a world that took that risky step and succeeded it deserves every praise,True,1760446227,3024,25
1903340,legitimately one of the best games i've ever played masterpiece all around and it's actually insane that this would technically be considered an indie game incredible narrative and worldbuilding that always keeps you guessing and absolutely worth playing through at least twice to catch all the subtle hints you wouldn't have caught the first time through every single thing in this game feels handcrafted and deliberate the combat system makes this feel almost more like an action game than an rpg think paper mario meets sekiro though the parrying is stricter than the latter for sure my only gripe is the act 3 and postgame scaling because by that point if you've been paying attention to the core mechanics you'll be pumping out insane damage numbers i was told 2 things going into act 3 beeline the story and do side content after the credits and do not use the new pictos they hand you at the start of act 3 until postgame i followed that advice and it made it a much better experience,True,1760445651,6658,31
1903340,it's good but it would be much better with a map,True,1760442803,1799,1
1903340,9510 one of if not th best games i've ever played,True,1760441770,2640,3
1903340,finally a good rpg turnbased game the mapareas looks amazin the skills and effects looks soo cool and the design on the enemies is like nothing i have seen before 1110 to sandfall studios,True,1760438538,1445,3
1903340,looks pretty but is fairly boring just a corridor rpg i'll try to play it all the way through and maybe i'll update this if it gets better,False,1760436899,167,33
1903340,superb,True,1760435126,3661,1
1903340,playing this game with my bf in our free time its awesome so far gustave's awesome and looking forward to max him out d,True,1760434065,3108,34
1903340,a top game of all time that you shouldn't miss,True,1760433981,5616,3
1903340,closest to ff7 i ever saw,True,1760431999,3528,10
1903340,,True,1760429632,2418,51
1903340,game so good i can forgive it for being french,True,1760427802,2607,1
1903340,one of the most unique games i have ever played the battle system is quite challenging and really really fun but not for everyone i would recommend this game to anyone it is a piece of art,True,1760427797,4326,2
1903340,beautiful gam,True,1760423946,2441,4
1903340,this game is absolutely beautiful from the music to the art to the characters everything is amazing and the story is absolutely stunning 1010,True,1760421900,1913,2
1903340,wonderful game,True,1760420671,3532,1
1903340,i started this game expecting it to be one of the best of 2025 fast forward to today when i beat it for the first time will probably play it again and not only has it surpassed all of my expectations it has become my favorite game of all time h3 technical aspect graphics h3 the weakest point of the game it's ue5 so get ready for noisy global illumination and shadows blurry presentation all throughout noticeable popin and a poor optimization that requires upscaling on an average midhigh end system h3 art direction h3 absolutely beautiful it is a masterpiece in every sense the character and enemy designs the use of different colours and aspect ratios for certain scenes the flow of the visual effects the creativity in the different sceneries every single detail you can think of is carefully placed and with a clear purpose behind it aside from a handful of moments you basically forget about all the technical issues because of how breathtaking everything looks h3 music h3 it's a masterpiece you can go listen to it right now on youtube or spotify if you don't believe me just don't listen to the lyrics especially if you know french because they are full of spoilers h3 exploration h3 very solid exploration is relatively contained but the lack of a map makes it engaging you really feel like an expeditioner discovering new things in a mostly unknown world and the game rewards you with currency to upgrade your gear new weapons and pictos stuff that gives you different buffs some side quests and harder bosses that give you even better rewards almost all of the side content contributes to the worldbuilding for instance without giving any spoilers you can find out what happened to previous expeditions and what they discovered h3 combat h3 in a word it is challenging it's turnbased but the enemies hit hard the game has dodge and parry mechanics the first being easier and the second giving you a chance to counterattack i played on expert difficulty and most enemies would kill me in 13 hits so i took my time to learn the parry timings this is what made me like the combat so much i usually don't like turnbased combat because i just have to wait until the enemy plays its turn and hope my character doesn't die with the parries i can actually do something and the punishing timings reward you with some extra damage if you succeed it's very engaging and fun on top of that you also have a lot of freedom when it comes to build variety oneshot shooter parryonly high hp for more survivability low hp for more damage and so on h3 story and characters h3 this is by far the best aspect of the game it hooks you from the very introduction even before you get to start the adventure you really feel for the characters and want them to succeed in their goals and aspirations the pacing of the story is excellent too just when you think you are figuring things out based on the breadcrumbs the game gives you the plot takes unexpected turns that keep you enganged from beginning to end i have to admit that the story made me cry a lot h3 verdict h3 if you read everything above you know the only thing i didn't like is the issues with ue5 everything else was basically perfect which is even crazier when you remember this is sandfall's first game ever clair obscur expedition 33 is the best game of 2025 and my personal favorite of all time 1010,True,1760417890,5925,16
1903340,3310,True,1760417281,3170,1
1903340,like,True,1760417196,886,3
1903340,great story very addicting and fun would highly recommend this game to anyone i usually don't enjoy turn style fighting but this game makes it so enjoyable,True,1760416206,5219,4
1903340,completed it on xbox pass and still decided it's worth buying on steam phenomenal soundtrack captivating scenery gameplay that hooks you up and story that gives a rollercoaster of emotions oh and standing bravo to whoever designed the battle with spoilersimonspoiler absolute menace of a boss with best music track,True,1760415041,1121,26
1903340,i expected nothing going into this game i remember seeing 1 trailer during some summer event found it much like the rest of the games visually and only keyed in when i saw it was turn based i wishlisted it on a whim and when the game came out i purchased it i didn't know at the time i'd not only be playing my personal game of the year but also one of my top 10 favorite games of all time there is not a single aspect of this game i would change every single detail artistically musically acting wise visual design story is absolutely phenomenal this game is absolutely not lacking in praise but i'd be remiss if i didn't leave my own thoughts as a review not since nier automata have i been so blindsided by a game's emotional tone being lured in by the strange and attractive and stunlocked by the gutwrenching turns every chapter every time i felt that i had the game figured out i was reminded i wasn't giving it enough credit after the start of chapter 3 i actually considered not finishing the game i felt like perhaps they had taken a turn in the story i didn't like and i didn't appreciate the big reveal nor how the main character was acting i pushed through narratively because the gameplay was never a chore and what i saw unfold was a huge middle finger to myself that once again said why did you not trust me on this and such a phenomenal conclusion to the game that i could even feel it seared into my brain for the rest of my life on the off chance anyone reads this not sure if you should get this game amidst the 60k other reviews let me just say that this experience is a beautiful love letter to games that inspired it something very close to the hearts of the developers and something that will affect games and game design in the industry for a long time this game does not erase any predecessor but rather uplifts them and says please take a look at where we came from play this game you will not regret it,True,1760414957,2403,11
1903340,it's true what you've heard been playing games for 25 years one of the greatest games i've ever played in my life 1010 masterpiece,True,1760413083,4055,4
1903340,holy cinema,True,1760410606,1816,15
1903340,game is simply beautiful game play soundtrack everything there's nothing much to say really recommend 1000,True,1760410430,3812,4
1903340,actual 1010 game,True,1760409737,1910,30
1903340,whooowheee 3310 never thought i would ever enjoy a turnbased game this much,True,1760408937,6045,13
1903340,1010,True,1760408853,3869,4
1903340,one of the best games of the year straight up it only has one weak point the game opens so well in what seems like a peaceful world and then it gets dark very fast there are so many moments of foreshadowing throughout the game that you only realize as the story unfolds and especially on a second playthrough that is when you truly notice all the hints about certain characters and events truly a fantastic story you can easily get lost in this game for several hours i have personally completed it twice once up to act 2 and this time on steam i finished it all the way story the story starts off almost peaceful only for you to realize that you actually live in a dark and twisted world especially with the paintress and everything that happens it is a solid 1010 and i rarely rate games that high but this one absolutely deserves it when you let devs cook this is what comes out of the oven there is so much clever foreshadowing that once you reach the end you will have that wtf how did i not notice this sooner moment music 1010 nothing more to add combat turn based so if that is not usually your thing give it a try anyway any og final fantasy fan will love this the only thing i truly dislike is the lack of a minimap the devs said it was meant to make you immerse yourself and feel like part of the expedition but by the time you reach the endgame it just gets annoying not knowing where you have been or what you have already explored that is not immersion that is frustration,True,1760408782,2697,1
1903340,good music and fun but challenging gameplay,True,1760408571,579,6
1903340,the game of the decade,True,1760408347,8666,1
1903340,5090 and 7800x3d constant crashing want to play as the story was good but can't,False,1760407465,1632,9
1903340,pros interesting combat ive never played a turnbased game with a parry system before you can basically nohit run this game once you understand how the damage system works you can make a lot of your party members broken as hell cons this one is personal the thirdperson offset camera gives me motion sickness i really hope this doesnt become an industry standard very poor choice level design is bad there are no iconic landmarks and after battles youll often get confused about which way you came from sometimes you can jump down certain areas but other times youre blocked by invisible walls super inconsistent the characters are horribly written spoiler warning there are many situations where the party couldve just asked why the hell did this happen but they never do until its too late and when it finally is they hilariously blame the very person they shouldve been questioning earlier,False,1760407445,3887,3
1903340,if this doesn't win goty i'm gonna crash out everything about this game is absolutely phenomenal the art is gorgeous the music is brilliantly rich the story is captivating and the gameplay is delightfully challenging absolute masterpiece 1010,True,1760407373,4556,4
1903340,it's hard to recommend this game enough without sounding pretentious when i tell you that it both is art and examines art on more levels than you'd expect i'm not sure what that would mean to you when i tell you that it's both very silly and very dark and more emotionally rich than you might expect from the intro level it's hard to convey that and do it justice so let me say this the art in all its various forms the visuals the music the narrative are all magnificent and will move anyone with a soul you will feel a broad gamut of emotions the combat is elegant and challenging in a rewarding way i don't tend to go for intense mechanical challenges like in a soulslike or a jrpg but this game marries both and has increased my tolerance for such an experience because it's fun certain combat things called pictos you collect might overwhelm your menus at some point in a very inelegant way but they also provide a massive amount of variety potential replay value and straight up shenanigans if you love a good mystery then you'll enjoy piecing this one together the pacing is very good and you will be left theorizing and speculating and discussing in that way that great stories and art pieces make you do so if you love a good story a good mystery a sense of wonder and exploration and fun combat that you can make infinitely easier or harder for the most part to your taste you should pick up clair obscur expedition 33,True,1760404432,8240,7
1903340,game of the decade,True,1760404315,3822,6
1903340,one of the best game i've ever played best game of the year 2025,True,1760403998,3971,34
1903340,this game is fantastic i love turnbased rpgs and the added mechanics of having to dodge or parry or you die brings a nice challenge to the game not to mention how beautiful the game is and how amazing the music is the story is a fresh perspective on dark fantasy my one gripe is the fact it portrays the french as a likable people which almost kills the game for me,True,1760403644,1593,5
1903340,i feel a hole in my chest after finishing this game the story and the mystery with the soundtrack and the interactive turn based combat with fantastic voice acting and visuals on top it's going to be a while till a game quite as jaw dropping as this one comes out this is going down as one of the greats and has earned the title of my favorite game of all time,True,1760403262,5314,15
