appid,review,voted_up,timestamp_created,playtime_forever,num_reviews
1903340,my review is quite late i do not normally review games and i struggled to describe this one beyond saying you must play it put simply claire obscur expedition 33 reawakened a childhood wanderlust it is only the second game in more than 20 years that has given me the surreal urge to journey and discover the world for myself the earliest game i recall giving me that feeling was the legend of zelda and more recently red dead redemption 2 red dead was more about immersion while e33 delivers an otherworldly experience i had no performance issues on my system with an intel core i711700k and an evga 3080 ftw as i progressed through the story i found myself constantly questioning and theory crafting where it would take me it was not predictable but it unraveled in a way that felt natural i wondered how the characters would travel and change and what they would learn about the world and their place in it the art style and music form a perfect backdrop to excellent cinematography writing and delivery the presentation is beautiful and rarely if ever misses a beat design influences i would relate to include bioshock alice madness returns persona devil may cry and final fantasy it feels like the best aspects of those series come together to deliver a memorable adventure the pacing was overall quite good the third act tightens up and several threads feel compressed but i did not rush through it i deliberately completed most optional content and finished nearly all side stories leaving only the toughest fights like simon for a post game return where i needed to optimize my build and practice my dodges that approach highlighted how rewarding the optional content and post game preparation can be character work is a major strength i badly wish one character who is lost early on had more screen time because his absence carried a strong emotional weight throughout the remainder of the story maelle is handled well she reads as her age while showing a maturity earned by struggle luna and cecile are welcome additions luna can be commanding and at times preachy but she never talks down without reason and she grows into the party rather than forcing herself on it at one point luna expresses joy at meeting the gestral village then i took a detour to the beach she sounds annoyed by us wasting time here with them which felt slightly inconsistent and jarring cecile is a joyful presence with a maternal or teacherly air that does not need exposition it just feels right her manner made me want to learn more the way the best teachers do their relationship never read to me as romantic in a shallow way they come across as sisters or best friends who may have drifted but would always have each others back the two later addition characters fit perfectly their banter and integration with the party felt natural one of them has a deep and interesting arc and a psyche that makes their presence meaningful without explicit explanation if i have to score it i give it a 9 out of 10 being nitpicky i might say 89 out of 10 because i noticed a few odd terrain moments while exploring off the beaten path such as waterfalls that seemed to end unnaturally on rocks and some jarring asset reuse in a few locations these issues came up only when i deliberately explored every corner of each level so they are minor but still present spoiler i really hope to see where they take this story next i can easily imagine some characters returning in a follow up but not quite as their former selves perhaps as figures who inspired their counterparts in that world one scene stood out as foreshadowing the two factions maelle is holding a cake while verso and clea stand among others on her left and gustave and emma stand on her right with a fairly distinct split between the groups it made me wonder if gustave and other characters in the canvas reflect someone verso or maelle knew in the real world who might be a part of the writer faction the characters we grew to love could become antagonists or at least appear in the next story without being entirely hostile since maelle and possibly verso have a connection with them spoiler,True,1760686248,4660,10
1903340,good game,True,1760685846,2290,24
1903340,yes,True,1760684818,2647,31
1903340,had me in tears such a beautiful game,True,1760684792,1933,27
1903340,this is a definitive benchmark for storydriven games the level of quality achieved is highly unlikely to be surpassed for a while everything about this game is perfect the gameplay is extremely addicting graphics are stunning and the soundtrack is just beautiful it's a breath of fresh air compared to the absolute aaa slop being released these days performance is also acceptable considering it uses unreal engine 5,True,1760681373,3223,66
1903340,one of the best games to come out in years great on every front with amazing gameplay story visuals and music,True,1760680486,4912,5
1903340,absolute cinema,True,1760679295,5384,8
1903340,for most of the first two acts this was my game of the year then they gutted their story couldn't care less about the story now had an epic hook great acting and storytelling at least spoiler up until the end of act 2 congrats anything you cared about doesn't matter spoiler,False,1760678395,2149,34
1903340,rating 33 out of 10,True,1760677503,4359,2
1903340,1010,True,1760676385,4943,4
1903340,common french w,True,1760675259,1537,1
1903340,this is a turn based game and i am not really into that kind of game but this game is a fresh take on turn based games the combat is great and the story is great and sad and all of the characters are likable and very easy to hate in a good way,True,1760675225,412,11
1903340,all the accolades are deserved it is well written scored and designed,True,1760675206,7079,10
1903340,absolute cinema excellent story soundtrack and worldbuilding the game is not quite challenging enough for me even on the highest difficulty and with some handicaps in the builds however the combat and character building system is novel interesting enough to make it still very enjoyable i thought silksong is the best game i've played this year but now idk can't decide which one is better so you should play both,True,1760674541,3371,10
1903340,i've played games that i have truly enjoyed and could spend happy endless hours playing and replaying them not this game this game i play once as thoroughly as i could made my decision at the end and was so impacted by the story and its consequences that it literally felt sincerely wrong to keep playing for those that have finished it you'll understand for those that haven't not only will you understand but this story will sit rentfree in your head for a long time after you turn it off and you unravel what you've just done like shrek this thing has layers my only advice to anyone picking it up for the first time don't breeze through the dialogue sit in it for a bit the painters painted a beautiful world the musicians orchestrated a masterpiece those fucking writers have ruined me for all other games,True,1760674465,5100,3
1903340,best game,True,1760674400,2924,2
1903340,goty balled my eyes out favorite story in any game can't glaze this game enough,True,1760672852,3214,46
1903340,the characters the story the music the artistic direction the combat the perfect mix of all of this makes it one of the best game i ever experienced problem is that now i have no idea what to playguess new game plus it is,True,1760670986,7416,8
1903340,this game is fantastic goty,True,1760670052,6697,1
1903340,great game the best i've played in a long time just give them your money,True,1760668962,600,15
1903340,french hotties,True,1760668855,1959,12
1903340,undisputably goty for me story 9510 teared up in the first 30 minutes of the game and during other moments of the game the premise buildup characters setting twists cutscenes etc made the story one of the best i've ever experienced from any type of media visuals 1010 hard to believe this game was developed by a relatively small company colors environments animations lighting all of them were so well done gameplay 910 don't knock the turnbased gameplay until you try it one of the best if not the best in the genre perfect blend of skill and comfort for me everything felt so fluid enemies can get a little repetitive after a long while and certain builds trivialize endgame but that may not even pose as a problem for a lot of people overall 9510 best game i've played this year deserves goty will riot if it doesn't win,True,1760668555,4222,13
1903340,what if you could fight enemies in a beautiful setting and also have your heart ripped out at the same time 1010,True,1760668538,2308,1
1903340,yeah the game is a masterpiece i would write a more detailed assessment but it really only comes down to a few factors either you have 50 and want to experience one of the best marriages of soundtrack visuals story and gameplay ever passionately made or you don't no pressure but this game has my full support for goty and i think i will always remember it fondly,True,1760668376,3353,34
1903340,this by far one of the greatest pieces of art i have ever experienced in my life the game forces you to actually think about the story its something i have never experienced or witnessed before there were so many man moments that made you just put the controller down and think in a age where every game coming out feels like repetitive soulless slop this game actually makes you feel something and thats something i am going to remember for a long time whenever i wasnt playing it i was thinking about it and that means something if you wanna play a game that lands in your top 5 games of all time play this game goty 100 top 3 game of all time 1010,True,1760668325,2157,48
1903340,so far the game is absolutely stunning best turn based game i've played so far and insanely good visuals,True,1760667900,1738,3
1903340,while the combat might not be the strongest for this game the story and the music makes up the flaws in my honest opinion and it is definitely up there,True,1760667379,2981,117
1903340,goty,True,1760664328,3950,22
1903340,great game but they killed off the only charecter i care about,True,1760663372,1317,11
1903340,the magic of clair obscur expedition 33 is embedded in its ability to give death a language the game's narrative dresses death in a wholly unique fashion through a captivating narrative with wellwritten complex characters and that's what resonates with me the most after all how do you communicate the unknowable inevitability thatarguablydrives us to do anything at all gameplaywise i had a lot of fun with the turnbased system which i wasn't expecting to enjoy because very few reconstructions manage to keep it engaging the entire dang time the game also gives the player a lot of flexibility in terms of things to do and explore without it straying too far from the central storyline i don't want to give away too much because i believe this game is best enjoyed blind if you're interested in what you see on the steam page but still feel a little unsure i encourage you to jump into the paint experience this piece of art and enjoy the ride along the way,True,1760662970,5310,13
1903340,i know i'm months late after beating this game back in june but i didn't think that i would finally play an indie that surpassed child of light as my favorite indie game of all time until now this game is not only the best game i played throughout this entire year but it's one of the best games that came out this console generation the story is a literary masterpiece that rivals fantasy franchises such as the lord of the rings in terms of the characters being very human in personality and going on an epic journey to save a civilization the gameplay is what modern final fantasy should have been where it's still turnbased but you can do other mechanics such as dodging and parrying attacks the game's visuals also look very good for an unreal engine 5 title where it looks like dishonored and bioshock infinite had a baby to create this game the music is beautifully atmospheric the only issues are that the mapping system in the game needs some work where the overworld has a proper map when traveling with esquie but if you're in a particular world you're completely on your own trying to figure out where to go a wave point system would've helped as well another issue is how inconsistent the dodging and parrying in combat can be regarding timing to avoid making a mistake this game is also pretty demanding for midrange hardware as well where my razer blade 17's gpu is directly equivalent to a desktop rtx 3060 ti and even then i generally get around 50'slow 60's in fps at 4k dlss performance at medium settings and the devs should really consider adding fsr and fsr frame gen for those whose gpu's are from an older generation that doesn't support dlssxess frame gen you're only option in that case would be to use software such as optiscaler or lossless scaling to add frame gen for those that lack the support another issue is the difficulty balance where even at the lowest difficulty the game's normalboss fights already feel like it's easier to die pretty quickly in the middle of the game's 1st act trainer mods were basically a necessity to make it easier to beat the entire game on pc i think if sandfall scaled the difficulty better in combat it would be more accessible for the average person to try out other than that this game is still a masterpiece in every sense of the word i recommend many people to try this out and i hope that this wins goty at this year's game awards,True,1760660352,1010,11
1903340,best game,True,1760660034,5938,1
1903340,awful game crashes instantly,False,1760658585,85,9
1903340,this is art,True,1760658243,4506,2
1903340,literal game of the year,True,1760656331,4856,9
1903340,holy shit,True,1760655412,2970,12
1903340,it's like the perfect blend of rpgs i like it has the level structure of final fantasy the combat of persona the dodging mechanics of the mario rpgs and it somehow all comes together really nicely it has the most beautiful combination of visuals and music i've ever seen in a video game and i mean that voting for goty this year is going to be so hard,True,1760654560,321,49
1903340,i'm not one to normally write reviews for games if i do they tend to be short or joke reviews not meant to be taken seriously hell i'm not even the kind of person to go around recommending games to people in general it's just not my thing however every single positive review of this game is true every single person calling this game a masterpiece they're telling the truth while i do have gripes over the turnbased gameplaycombat it's leagues better than most other turnbased rpg's i've played and honestly the gripes are rather minor for the studios first game combat starts off good enemies are tough but forgiving and it takes you time to learn the parrying timing and the builds for characters using pictos and lumina are plentiful and fun late game however it can turn into a bit of a bummer as you can easily begin to overpower most enemies including the final boss of the story that aside though everything else about this game is well words fail me in trying to capture the sorrow grief joy and wonder this game inspires from the breathtaking landscapes and enemy design that just look like beautiful paintings to the phenomenal soundtrack that to this day has me crying anytime it plays to the narrative direction and stellar voice acting the game hits every single aspect with the passion of artists inspired by god himself and the story holy fuck the story starts off as stated but it will begin to drop hints as to the overall plot here and there until by the end of act 2 you are left stunned shocked mouth agape as they reveal each major plot point that's been hidden in plain site the entire time it gets to the point where every single word delivered by the characters have so much weight and meaning behind them that i personally had to pause after each sentence just to make sure i was processing the mountains of information beind dumped over the course of minutes but not just the grand reveal the story captures and immerses you in the world of our cast and you end up falling in love with each of the characters learning who they are their ambitions goals attitudes life stories they're all so fleshed out that they feel like real people and when shit starts happening to them in game that relationship you build up with them comes in and hits you hard and it gets harder and harder as the story goes on and you learn the truth of everything it's so moving so heart wrenching that it will leave you in tears long after you set down your controller and turn off the game this game has touched me it has moved me and i have never felt so seen and heard by any piece of media in my life this game's story has helped me heal old trauma i thought i had let go of i feel as if the writers knew my story and wanted to tell me we hear you we see you we understand and we're here for you i cannot express accurately in words what that means to me but i hope that the people who read this review will understand what it means because i can't explain it without spoiling the entire plot lol essentially what i'm trying to say is that this game is in essence a love letter it is a love letter to art to artistic expression the creative process it is a love letter to the artist to the gamer to humanity and everyone who has an expressive creative heart it is an ode to what makes art art if you are a creative person if you like deep narrativedriven stories if you want to feel your heart ripped out and put back in along with a sense of catharsis that will leave you with a weekslong emotional high if you've ever created something as a way of expressing yourself then you will fall in love with clair obscur expedition 33,True,1760653550,1252,19
1903340,magnifique,True,1760652991,3633,11
1903340,one of the most innovative and creative worlds in gaming storycharactersmusiccombat etc is a 1010,True,1760652342,3374,3
1903340,bro why are you reading reviews right now just get this artistic masterpiece and treat yourself to one of the greatest experiences the gaming world has to offer,True,1760651784,5972,6
1903340,peak this shit has to win goty,True,1760650991,2370,23
1903340,a wonderful piece of art from start to finish 1010 soundtrack and story,True,1760646627,1598,1
1903340,i'm going to list out my thoughts here and get right to it cons mocap jank model clipping such as the rose gustave holds or unrealistic item handling the cup full of wine being thrown around by gustave but somehow he still has wine left in cutscenes can detract from the immersion especially when everything else is working so much in its favour facial animationsexpression outside of cutscenes are non existent especially noticeable in attack animations making what should be a dramatic and dire situation seem quite goofy attack effectsrope effects are quite excessive the fx often explode over the models in a glossy distorted manner often compiling on each other and looking messy whilst the attacks are all incredibly hype i do wish i could see the artistry in them with more controlled and relevant fx overlays most enemy attacks don't suffer this problem it is mainly the player characters not a good game for game beginners not a huge downside but the game does make a lot of assumptions on your knowledge of video game mechanics in general this makes sense for a game that pays homage to so many rpgs of old but i can understand the frustration of those unfamiliar pros great pacing both narratively and mechanically i felt a flow through till the beginning of the third act never quite getting stumped but always having a challenge and a sense of direction movie quality cutscenes aside from jank mentioned before performance and script is crafted and delivered beautifully alongside a heart tugging soundtrack fun gameplay arguably the most important part of any game the parry system is a rewarding skill to learn abilities and skills bring a variety of strategy and with a dramatic flourish attacks hit with a punch against your enemies or right back at you beautiful art direction while i can see where some criticism in its shiny unreal engine appearance the different locations in the game and enemy designs ooze character whilst matching elegantly with the themes of clair obscur a wonderfully told heartfelt story that you can't pull yourself away from an instant classic,True,1760646196,4167,11
1903340,this game is amazing 1010 goty,True,1760645787,2987,2
1903340,lorien testard je t'aime 3,True,1760645729,825,11
1903340,it is an amazing game with strong story and characters 1010,True,1760645249,3222,7
1903340,first game since elden ring that has actually blown me away and made me seriously consider to take off the next day just to keep on playing absolutely incredible,True,1760644294,1266,25
1903340,amazing experience and story,True,1760644202,7952,2
1903340,perfect baguette,True,1760643350,4661,3
1903340,do not let the turn based combat steer you away this game is so peak,True,1760643277,2803,22
1903340,yes,True,1760642562,10648,1
1903340,pure perfection just pure perfection,True,1760642021,1564,13
1903340,this is high art just play it,True,1760640147,3728,1
1903340,should be goty 2025,True,1760639762,2209,10
1903340,this is goty anyone who disagrees will be fed to nevrons,True,1760638570,1792,19
1903340,its so good,True,1760637418,2263,1
1903340,my simplified results will be at the bottom of this so i'll start by saying thius game its fine i have two issues on this story because the story is unique no game on this year's game awards including red riding hood beetle or sheher hades and stranded to death by too much cardio 2 got this level of story and the game style for me its kind of whatever because i do no play this type of turn base but the narrative the vibe the music and the style trumps it and that speaks volumes and the story mode helps gameplay the story mode difficulty is hard imagine the normal one god forbit a brother just be trying to enjoy the vibes granted most of my gameplay was a sonic game trying to go past the enemies and that ultimately didnt let me level up but we cant confirm for sure its a hunch sparring mechanics became the ultimate heartsopper i kept trying to figure out what the fck am i looking at if it was a leg or an arm or a vulva unpredictable hits every time these enemies need more coordination on how to hit and be less flamboyant about it which im fine by it we gotta keep in mind this is a french game and its a different culture but i also didnt see a lot of hijabs if this was inspired by france story here is the cream of the crop the story unpredictable surreal odd but flawed but dont worry because ill tell you the two issues issue 1 the story deals around mourning letting go of loved ones the conflict that happens either to cope with the person you loved or continue with your live there are also subtle touches of guilt and family relations all established on this fantastical environment i personaly cant relate to the characters the topics at hand are one dimensional and frankly i cant relate humph pumph issue 2 spoilers they killled my goat gustav this is unbelievable these pieces of dookie croissant devs introduced us with gustav in this beautiful world and showed him saying his last goodbye to his gf and at that moment i realized i am gustav he is me he got a cool mustache and he is equally as insecure on this dirty world as me fck he was a good person he even made a little journal for those who come after i used to stop for 10 minutes hearing the journal music taking it in after all we went through all of the sudden he gets killed like a doooooog my goooooaoat did nooooot had to die i am now empty i cant eat i only watch the loading screen of the youtube vids in silence because i only hear the deafening sounds of the humming from our journal sessions oh gustav and not only that after the big reveal that we found out that we can revive people we found that the only person that cant be saved was gustav fuck man c0ck teasing me like thatand on top of that after the big reveal we find out that our goals and dreams were for nothing nothing gustav died like a dog for nothing next time i see a french person im gonna remember them where were you when gustav fell i bet these stupid game devs are rolling over the idea of making me as the main character and die for nothing i cannot understand and then and then they swap him for gustav zero sugar aka verso he is fine character i guess but imagine going to work and seeing another person at your desk and he says oh you didnt know my summer is ruined i got ptsd when i hear french and i cant journal anymore conclusion fine game 810,True,1760635926,1291,6
1903340,i wholeheartedly recommend this game every element the music the story and the visuals come together to give the player a fantastic experience,True,1760635650,2009,4
1903340,documentary about how french families will do anything but let their girls have fun 1010 will punch my mate simon in the face again,True,1760635470,2249,6
1903340,as a big fan of the final fantasy series but someone who hates the grinding required to complete the games i absolutely love clair obscur it has everything i love about ff and more the battle system feels fresh the balance is great the levels are beautiful and the story is engaging no matter what you read about this game it won't do it justice i absolutely recommend playing it,True,1760635298,4123,9
