appid,review,voted_up,timestamp_created,playtime_forever,num_reviews
1903340,first game in a while i've truly been hooked and excited to play the story is thrilling and suspenseful the turnbased combat is the best i've experienced this game should be 2025 goty no doubt,True,1760295881,3017,26
1903340,i picked this game up not thinking it was going to live up to the hype i'm surprised to say that even with my doubt it far exceeded all expectations combat is truly unique and fulfilling and the story is absolutely fantastic i'm with everyone who says this game is amazing because it actually is,True,1760295875,3676,5
1903340,1010 don't have anything to critique,True,1760295082,2130,7
1903340,one of the most emotional storytelling i've ever seen this game broke me if this isn't game of the year i won't know what is anymore,True,1760294719,1398,55
1903340,33 people go on an expedition to become grandparents,True,1760294400,990,42
1903340,masterpiece this game has got it all amazing soundtracks beautiful visuals interactive turn based combat astonishing character development and a story unravelling under layers of emotional existential and moral complexities finishing this game will have you staring at the ceiling questioning life feeling empty yet complete make sure you have some tissues on hand this game is a prime example of how we do not need aaa game studios for 1010 games kudos to sandfall interactive for showing how it's done and setting the bar skyhigh,True,1760293735,1816,3
1903340,best game of the decade hands down,True,1760293124,6803,3
1903340,personal game of the year 2025,True,1760292784,5124,7
1903340,absolutely incredible game play world building characters sound track i love it all just beat the story and i still feel like there is tons of side stuff to do that i'll be working through next i'm sure i'll be playing the story again too at some point 1010,True,1760291666,4690,4
1903340,we continue,True,1760291285,2484,11
1903340,story alone is worth it interactive and challenging gameplay wonderfully written and voiced characters make it even better play it,True,1760289361,1710,2
1903340,it is cinema,True,1760289049,6183,2
1903340,goty,True,1760288831,2392,7
1903340,if this game doesnt get game of the year there will be riots everything about this game is amazing from start to finish my only complaint about it is that its french i feel like this game portrayed french culture the paris olympics,True,1760288681,3303,1
1903340,goty ts so good,True,1760288109,2725,3
1903340,don't read anything online don't read reviews don't watch videos go into this completely blind don't google anything during playthrough just experience it for yourself i did that i intentionally avoided any information about this game other than seeing glowing reviews even skipped reading those mostly i have a few games i played in my long life that i would say are proper art form elevated beyond what one expects in such medium this is one of them firmly sitting near or on the top don't think don't read don't search just play it,True,1760288089,2382,8
1903340,if possible i would put this as a maybe but as i have to pick between yes and no ultimately i choose no expedition 33 is a game about closure that ironically does not know what it wants the game pretends it is a turn based rpg however there are so many quick time events that being able to parry is a much more important skill than understanding the mechanisms behind team comp parrying is so good that if you're not doing it the game will feel like a punishing slog if you are doing it you don't need the turn based aspect because you can kill nearly every encounter easily the story wants to wrench at your heart strings and make you think however after dramatic moments when people are actively sobbing you will also encounter the gestral beach nearby where you can do jumping puzzles to put your depressed sad women in bikinis the game wants to present a terrifying and mysterious world ala bloodborne but at the same time keeps enough light hearted optional side areas around that the tone frequently whiplashes the story builds up to a climatic choice spoilers ahead will you return to being a crippled and disfigured girl for life or remain in a world of wonder with loving friends and family facing reality vs escapism all that build up about the complexity of life is reduced to a trite binary choice not even mentioning that one essentially kills the entire magical world so you can go sort out your upper class parents fighting over who can be maladapted better and you of course regardless of your choices can do new game because in a game about choices and closure there's nothing like replaying it and remaking your choices this is something fancy game reviewers sometimes call ludonarrative dissonance lastly i need to critique the game itself i needed 2 mods to actually get the game to run without crashing one for the combat to stop crashing thanks directx12 and one for the cutscenes to not crash because if you switch to dx11 to fix the formeryeah no i make it a rule not to recommend games that don't work out of the box and this game did not the game has lovely worldbuilding a fascinating environment a great hook to start you out and solid visual design unfortunately it can't choose what it actually wants to be between its combat its story and its fundamental game design ultimately i much more enjoyed act 2 than anywhere else because act 3 felt trite and act 1 drip feeds you the tools you need to actually enjoy things so i lean on the side of no because there are much better rpgs out there much better turn based strategy and much more coherent stories that don't muddle their metaphors,False,1760287653,1848,49
1903340,story is amazing,True,1760286172,785,1
1903340,absolute cinema,True,1760286015,6309,3
1903340,probably the best turnbased game i've played with really good story and incredible everything 1010,True,1760285963,3034,17
1903340,it's been a while since i played a game this engaging and visceral 1010,True,1760285595,4643,1
1903340,clair obscur expedition 33 is the best game i've ever played the story is one of the best i've ever experienced the characters are wellwritten and their dialogue feels natural expedition 33's art style is stunning and the enemy and boss designs are fantastic this is the first turnbased game i've played and completed but it played really well and was a lot of fun the amount of collectibles you can find in the various locations is very nice and the lategame content after defeating the final boss is a great addition to the story for those who want to experience everything doing 100 was also a lot of fun 3310 highly recommended,True,1760285574,4350,42
1903340,music verso gameplay story all top 5 all time all wee no woo,True,1760285480,4340,8
1903340,1010 don't look up the story don't look up the gameplay just treat yourself and play the damn thing,True,1760284689,2010,2
1903340,made me like france,True,1760284159,4652,5
1903340,h1bclair obscur expedition 33bh1 iimportant premise the following review is based on my personal experience everytime i write a review i try to be as objective as possible in order to not let my personal tastes taint the objective quality of the producti h1graphicsh1 very high graphics quality a noteworthy job has been done especially about the details regarding lights shadows colours particle and environmental effects a praiseworthy attention to detail has been put in every location leaving no stone unturned the facial expressions in the cutscenes are of great quality as well it is possible to witness a strong artistic inspiration in many places of the game bscore 97 10b h1narrativeh1 the narrative rhythm is well matched with the gameplay creating a good balance between the player's interaction and the progression of the story the subject matters of the story have been tackled in an intelligent sensible and skilful way the dialogues are of great quality and the characters are well portrayed bscore 96 10b h1gameplayh1 the difficulty level is impeccably coherent with its description the software optimization is very good on a machine that surpasses the recommended requirements it is possible to play at 60 fps with half settings on high and half on maximum the fighting system is creative functioning varied and designed to be friendly with any kind of player bscore 87 10b h1soundh1 fautless voice acting the sound effects are very clear clean and detailed favouring a great immersion in the game bscore 93 10b h1musich1 the product has many high sublime quality soundtracks each one coherent with the circumstance during which it's played bscore 10 10 b h1overallh1 on the overall it's a game i'd recommend to try to any player regardless of personal tastes it's a product of great quality with excellences in more than one field bscore 47 5 b,True,1760283789,2449,88
1903340,goty 2025,True,1760283583,2140,1
1903340,'tis a lovely game,True,1760282871,984,3
1903340,the acting the story the music the characters the world i mean what is not to love it took all the parts of gaming that we are told not to love put the together with a fresh and rewarding combat system and you get ce 33 incredible game,True,1760282806,5521,5
1903340,the french did something right,True,1760282753,4015,6
1903340,clair obscur expedition 33 well friends first of all i have to say wow without a doubt one of the most beautiful games i've ever played the game was fantastic in terms of story it had a beautiful emotional and deep story i really liked the characters in the game and connected with them a lot to be honest the game was so exciting and beautiful that sometimes i forgot whether it was a game or a movie o the game world was very beautiful and i really liked the combat system of the game it was quite exciting you couldn't get bored at all and it made the game more interesting the game's soundtrack was a masterpiece so much so that i wanted to listen to the soundtrack for hours in the game's menu and music is the literature of the heart it commences where speech ends the music in the game was perfectly combined with the story of the game and gave me a better feeling and it was great clair obscur expedition 33 showed us how much a game can affect the soul and challenge all its emotions the visuals and cinematic were amazing the only problem i had was that it was really hard to take screenshots in the game and a photo mode would have been a great help in showcasing the game's beauty the game really deserves the best game of the year because the story was great the soundtrack was a masterpiece the graphics were good and the visuals were amazing and i would be really happy if i saw this game become the best game of the year i say from the bottom of my heart that it really deserves it and this game was a place where art was well displayed a place where the combination of painting and music played with the soul a place where tears were filled with seeing all this beauty a place where life flowed i want to end this review with a quote related to the game life is just like painting draw the lines with hope erase your mistakes with peace dip the brush in great patience and paint with love,True,1760282544,3414,155
1903340,this is the best game i ever played and it is not even close,True,1760281527,2064,2
1903340,1010 revolutionary a beautiful and incredibly original game with a deep and moving story expedition 33 has such well written and mature characters and a script that assumes you are an intelligent adult and doesn't spoon feed you superb turnbased combat the game is fast snappy getting in and out of battles is a dream and the ui is always responsive the battles are very satisfying highly recommend playing this at 60 fps if you can ultimately this is a fantastic turnbased jrpg at the core with an incredible french spin and lots of modern and well implemented gameplay mechanics the voice acting was wonderful throughout and i think andy serkis was superb as renior the soundtrack to this game is phenomenal they knocked it out of the park so many beautiful moving tracks but also upbeat epic and fun tracks as well many of them are stuck in my head days after playing the game it reminds me of the original final fantasy vii soundtrack i highly recommend watching skill up's the making of clair obscur on youtube to learn more about the small team behind this game and better understand their achievement,True,1760279885,4683,35
1903340,loved this game so much it does have quite a few graphics issues honestly and the massive amount of bosses that repeated quite a lot was a bit much but again minor things really nice game,True,1760278899,12531,9
1903340,one of the most compelling explorations of grief i've experienced and truly a labour of love best experienced blind and at your own pace tomorrow comes,True,1760278727,2698,4
1903340,great story and game mechanics level design is also great except it's hard to find a way to proceed,True,1760278445,1894,2
1903340,excellent game full support for the developers,True,1760277949,10977,10
1903340,best of this year,True,1760276847,2668,8
1903340,3,True,1760276557,4715,17
1903340,i would give this game a rare 1 out 5 for the reason i tried giving this game so many chances and all the reward was confusion bugs hardware issues for the game itself i will admit its quite possible im just stupid but i dont understand what the game wants me to do 90 of time spent wandering around in confusion or fighting enemies im apparantly not supposed to fight yet sure the game has a nice story woulda worked better as a visual novel lol,False,1760276179,222,2
1903340,goty,True,1760275902,2680,7
1903340,master piece any game award this game doesn't win this year is toilet paper,True,1760275466,2359,4
1903340,the story line of this game sucks you in from the beginning and leaves you yearning to find out what happens next the game play is pretty fun too,True,1760274873,3089,1
1903340,melancholic poignant but also very funny in certain moments well deserved the hype imo,True,1760274741,6838,49
1903340,the best game i've had for a very long time,True,1760273890,5435,8
1903340,its quite good the cinematics are better then what hollywood can pump out nowadays story is ok i dont really care about any of them they try too hard to be relatable or maybe thats the point of the whole thing would i play it again no would i bother with any story dlcs also no however its still worth a play through,True,1760272602,1276,15
1903340,1010 not trying to glaze but its simply peak art,True,1760271959,3327,11
1903340,what makes clair obscur expedition 33 worthy of recognition isn't just how well everything works but the fact that it all sticks with you the characters the music the world design the emotional throughline that runs underneath all the strategy and spectacle none of it ever fades into the background clair obscur is the kind of game that lingers after the credits roll not because of how much it offers but because of how much it gets right its rare to see a game so mechanically confident and emotionally grounded but that's exactly what clair obscur expedition 33 is,True,1760271537,3430,34
1903340,bought the game during autumn sale but it would have been worth full price very happy with the purchase within the first hour of playing,True,1760271523,1430,4
1903340,absolute cinema,True,1760271119,2806,4
1903340,,True,1760270205,3699,7
1903340,you seem disappointed you've got a spoilerswimsuitspoiler after a jumping challenge take another one 1010,True,1760269388,2404,4
1903340,goty,True,1760268706,6211,5
1903340,great story totally unexpected,True,1760268326,1826,2
1903340,this game is a masterpiece best game i played in the past 10 years and i never was a fan of jrpgs before,True,1760268193,3232,1
1903340,like if xenoblade chronicles 3 elden ring and the entire final fantasy series were combined into one perfect game just play it already,True,1760266515,1394,3
1903340,the original storyline combat system travel and camp and creative places best game i've played,True,1760266104,3870,2
1903340,an absolute banger of a game its story now lives rentfree in my head and in my heart i look forward to more games from sandfall interactive stop reading reviews and play expedition 33 now,True,1760265566,6478,24
1903340,should be the goty 2025,True,1760265508,3651,1
1903340,superb,True,1760265130,1199,26
1903340,this game is fucking peak every single time i play it is greatness the more hours i put in the more i keep thinking wait there's more the story just gets better and better i was going to stop playing 10 hours in but god mother fucking damn am i glad i stayed,True,1760264964,2139,5
1903340,graphics you forget what reality is beautiful good decent bad dont look too long at it msdos gameplay very good good it's just gameplay mehh watch paint dry instead just don't audio eargasm very good good not too bad bad i'm now deaf audience kids teens adults grandma pc requirements check if you can run paint potato decent fast rich boi ask nasa if they have a spare computer game size floppy disk old fashioned workable big will eat 15 of your 1tb hard drive you will want an entire hard drive to hold it you will need to invest in a black hole to hold all the data difficulty just press 'w' easy easy to learn hard to master significant brain usage difficult dark souls grind nothing to grind only if u care about leaderboardsranks isn't necessary to progress average grind level too much grind you'll need a second life for grinding story no story some lore average good lovely it'll replace your life game time long enough for a cup of coffee short average long to infinity and beyond price it's free worth the price if it's on sale if u have some spare money left not recommended you could also just burn your money bugs never heard of minor bugs can get annoying ark survival evolved the game itself is a big terrarium for bugs 10 1 2 3 4 5 6 7 8 9 10,True,1760264714,3746,18
1903340,best game ever fucking made hands down,True,1760263781,4741,50
1903340,incredible game one of the best music from video games as a turn based game lover the combat was perfect for my taste it was perfect mixture of action and turn based parry felt satisfying throughout the game pictos was great ways to customize the characters,True,1760261521,1328,2
1903340,just ignore that they're french,True,1760260590,4519,5
1903340,best game i've ever played the game is not without its flaws awful luminapictos menu pages lack of ingame checklists would be nice to have recommended levels for each world etc but they're overshadowed by everything else the game does great the fact that it's the developer's first game is just ridiculous the characters story gameplaycombat systembuild variety creativity and especially the soundtrack are all top tier i've never been so sad about finishing a game and i don't think i'll ever enjoy an rpg or jrpg as much as this one as someone who doesn't buy many games outside of the summerwinter sales this game is absolutely worth the 50 full price getting it on sale is great but if you can afford to pay full price i think waiting months or even years to see this game get a 25 discount just isn't worth it the game is too good it's way better than a lot of the 70 new bigname games we get nowadays that are never worth that much money,True,1760258260,4933,4
1903340,good gmae,True,1760257574,2216,13
1903340,1110 i wish more turnbased games had this kind of gameplay,True,1760256609,7312,102
1903340,wow,True,1760253228,2362,5
1903340,a masterpiece what more is there to say that hasn't already been said about this game incredible story godtier soundtrack phenomenal voice acting spectacular graphics it can make you laugh one minute and have you wiping away tears the next play it already what are you waiting for,True,1760251631,4454,3
1903340,peak,True,1760249216,1885,1
1903340,peak if it doesn't win goty at least let it win best art direction or best soundtrack because both were brain altering levels of beautiful 3333 originally played on gamepass but came here and bought the deluxe edition to support these amazing developers,True,1760248080,300,1
1903340,my favorite game probably over the past decade,True,1760247792,6447,3
1903340,one of the best games ever made,True,1760247434,6967,3
1903340,my goty especially the developer's journey to build this game that dedication truly inspiring,True,1760246095,7585,10
1903340,1010 story and gameplay,True,1760245939,1667,4
1903340,goty,True,1760245106,938,1
1903340,beautiful game beautiful story i'm not amazing at doing qtes but i still enjoyed the fights even if they took me many tries i highly recommend obviously this game is very weee,True,1760244246,2366,22
1903340,thank you france,True,1760243543,1855,2
1903340,w game,True,1760243090,1086,2
1903340,gg,True,1760242811,779,8
1903340,masterpiece some of the best game osts i've honestly ever heard in a game not to mention the story which was immaculate definitely a very strong contender for goty even if it doesn't officially win it has already won in the hearts of many,True,1760241916,2663,21
